VCCH-VET1208-FB,"Burnt Olive Vintage Cotton Velvet Fabric","0","0","0","0.0000","",""
VCCH-VET1209-FB,"Iron Grey Vintage Cotton Velvet Fabric","0","0","0","0.0000","",""
VPCH-110602-FB,"Signature Off White Blackout Velvet Fabric","0","0","0","0.0000","",""
VPCH-120601-FB,"Signature Ivory Blackout Velvet Fabric","0","0","0","0.0000","",""
VPCH-141113-FB,"Signature Wheat Blackout Velvet Fabric","0","0","0","0.0000","",""
VPCH-145002-FB,"Signature Silver Grey Blackout Velvet Fabric","0","0","0","0.0000","",""
VPCH-184005-FB,"Signature Natural Grey Blackout Velvet Fabric","0","0","0","0.0000","",""
VPCH-190622-FB,"Signature Hunter Green Blackout Velvet Fabric","0","0","0","0.0000","",""
VPCH-190912-FB,"Signature Java Blackout Velvet Fabric","0","0","0","0.0000","",""
VPCH-192018-FB,"Signature Burgundy Blackout Velvet Fabric","0","0","0","0.0000","",""
VPCH-192315-FB,"Signature Eggplant Blackout Velvet Fabric","0","0","0","0.0000","",""
VPCH-194007-FB,"Signature Warm Black Blackout Velvet Fabric","0","0","0","0.0000","",""
VPCH-194023-FB,"Signature Midnight Blue Blackout Velvet Fabric","0","0","0","0.0000","",""

