Fabric Code,Name,Safety Lock,Min Alert Qty,Delivery Days,Per Yard Retail Price
birva,"test2","0","56","0","0.0000","",""
CC-CD14-FB,"Gold Multi Hand Weaved Cotton Fabric","0","50","0","10.0000","",""
CC-CD17-FB,"Teal & Natural Hand Weaved Cotton Fabric","0","0","0","0.0000","",""
CC-CD22-FB,"Antique Gold Hand Weaved Cotton Fabric","0","0","0","0.0000","",""
CC-CD29-FB,"Red & Gold Hand Weaved Cotton Fabric","0","0","0","0.0000","",""
CC-CD34-FB,"Sienna Multi Hand Weaved Cotton Fabric","0","50","0","0.0000","",""
CC-CD35-FB,"Blue & Beige Hand Weaved Cotton Fabric","0","0","0","0.0000","",""
CC-CD36-FB,"Blue Multi Hand Weaved Cotton Fabric","0","50","0","0.0000","",""
CC-CD37-FB,"Blue & Taupe Hand Weaved Cotton Fabric","0","50","0","0.0000","",""
CC-CD38-FB,"Black & Cream Hand Weaved Cotton Fabric","0","0","0","0.0000","",""
CC-CD42-FB,"Grey Hand Weaved Cotton Fabric","0","50","0","0.0000","",""
CC-CD43-FB,"Red Hand Weaved Cotton Fabric","0","50","0","0.0000","",""
CC-CD44-FB,"Black Hand Weaved Cotton Fabric","0","50","0","0.0000","",""
CC-MA1-FB,"Beige Casual Cotton Fabric","0","50","0","0.0000","",""
CC-MA2-FB,"Brown & Black Casual Cotton Fabric","0","50","0","0.0000","",""
CC-MA3-FB,"White Hand Weaved Cotton Fabric","0","0","0","0.0000","",""
CC-MA4-FB,"Gold & Black Casual Cotton Fabric","0","50","0","0.0000","",""
CC-MA5-FB,"Mocha & Teal Casual Cotton Fabric","0","0","0","0.0000","",""
CC-MA6-FB,"Black & Silver Casual Cotton Fabric","0","0","0","0.0000","",""
CC-MA7-FB,"Beige & Gold Casual Cotton Fabric","0","50","0","0.0000","",""
CC-MA71-FB,"White Multi Hand Weaved Cotton Fabric","0","50","0","0.0000","",""
CC-MA8-FB,"Brown & White Casual Cotton Fabric","0","50","0","0.0000","",""
CC-MABB26-FB,"Lemon Grass Hand Weaved Cotton Fabric","0","0","0","0.0000","",""
CC-MABB32-FB,"Plaid Casual Cotton Fabric","0","50","0","0.0000","",""
CC-MAMGBB02-FB,"Moss Green Casual Cotton Fabric","0","50","0","0.0000","",""
CC-MASB78-FB,"White & Beige Hand Weaved Cotton Fabric","0","50","0","0.0000","",""
CC-MASB81-FB,"Beige & Grey Casual Cotton Fabric","0","50","0","0.0000","",""
CC-SB73-FB,"Multi Casual Cotton Fabric","0","50","0","0.0000","",""
CC-TEALBB29-FB,"Teal Hand Weaved Cotton Fabric","0","0","0","0.0000","",""
CRC-MYTH04-FB,"Naomi Embroidered Cotton Crewel Fabric","0","0","0","0.0000","",""
CRC-MYTH14-FB,"Sophie Embroidered Cotton Crewel Fabric","0","0","0","0.0000","",""
CRC-MYTH72-FB,"Chantal Embroidered Cotton Crewel Fabric","0","0","0","0.0000","",""
CRC-MYTH73-FB,"Elise Embroidered Cotton Crewel Fabric","0","0","0","0.0000","",""
CRC-MYTH79-FB,"Aurora Embroidered Cotton Crewel Fabric","0","0","0","0.0000","",""
CRC-MYTH809-FB,"Lorraine Embroidered Cotton Crewel Fabric","0","0","0","0.0000","",""
DIS-ID1-FB,"Lily White Textured Dupioni Silk Fabric","0","0","3","0.0000","",""
DIS-ID112-FB,"Chili Pepper Textured Dupioni Silk Fabric","10","0","30","8.0000","",""
DIS-ID124-FB,"Chocolate Textured Dupioni Silk Fabric","0","0","0","0.0000","",""
DIS-ID15-FB,"Biscotti Textured Dupioni Silk Fabric","0","0","0","0.0000","",""
DIS-ID20-FB,"Sunrise Gold Textured Dupioni Silk Fabric","0","0","0","0.0000","",""
DIS-ID221-FB,"Navy Textured Dupioni Silk Fabric","0","0","0","0.0000","",""
DIS-ID224-FB,"Black Textured Dupioni Silk Fabric","0","0","0","0.0000","",""
DIS-ID37-FB,"Restful Green Textured Dupioni Silk Fabric","0","0","0","0.0000","",""
DIS-ID50-FB,"Mocha Textured Dupioni Silk Fabric","0","0","0","0.0000","",""
DIS-ID511-FB,"Silver Bell Textured Dupioni Silk Fabric","0","0","0","0.0000","",""
DIS-ID68-FB,"Shoreline Textured Dupioni Silk Fabric","0","0","0","0.0000","",""
DIS-ID7727-FB,"Pearl Textured Dupioni Silk Fabric","0","0","0","0.0000","",""
DIS-ID7806-FB,"Cashmere Textured Dupioni Silk Fabric","0","0","0","0.0000","",""
DIS-ID7906-FB,"Winter Blue Textured Dupioni Silk Fabric","0","0","0","0.0000","",""
DIS-ID9-FB,"Maplewood Textured Dupioni Silk Fabric","0","0","0","0.0000","",""
DS-ASST100-FB,"Nob Hill Silk Stripe Fabric","0","0","0","0.0000","",""
DS-CHX14-FB,"NEW: Oxford Silk Plaid Fabric","0","0","0","0.0000","",""
DS-CHX4-FB,"NEW: Derby Silk Plaid Fabric","0","0","0","0.0000","",""
DS-D12012-FB,"Wilmington Taffeta Silk Stripe Fabric","0","0","0","0.0000","",""
DS-D22012-FB,"Genoa Silk Taffeta Plaid Fabric","0","0","0","0.0000","",""
DS-D32012-FB,"Windsor Taffeta Silk Stripe Fabric","0","50","0","0.0000","",""
DS-D42012-FB,"Somerset Silk Stripe Fabric","0","50","0","0.0000","",""
DS-DST2-FB,"Cairo Dune Silk Stripe Fabric","0","0","0","0.0000","",""
DS-DST4-FB,"Cairo Haze Silk Stripe Fabric","0","0","0","0.0000","",""
DS-DUPST1-FB,"Varadero Silk Stripe Fabric","0","0","0","0.0000","",""
DS-DXB20-FB,"Sausalito Silk Stripe Fabric","0","0","0","0.0000","",""
DS-DXB66-FB,"El-Dorado Silk Stripe Fabric","0","0","0","0.0000","",""
DS-DXB69-FB,"Palm Springs Silk Stripe Fabric","0","0","0","0.0000","",""
DS-EFCH10A-FB,"Eastwood Silk Taffeta Plaid Fabric","0","0","0","0.0000","",""
DS-EFCH14-FB,"Newman Silk Taffeta Plaid Fabric","0","0","0","0.0000","",""
DS-EFCH38-FB,"Knotts Landing Silk Taffeta Plaid Fabric","0","0","0","0.0000","",""
DS-EMBS20131-FB,"Carliyle Pearl White Thai Silk Fabric","0","50","3","0.0000","",""
DS-EMBS201310-FB,"Chai Brown Gold Silk Fabric","0","50","0","0.0000","",""
DS-EMBS201311-FB,"Rowena Gold Dust Silk Fabric","0","50","0","0.0000","",""
DS-EMBS201312-FB,"Toulon Sea Blue Silk Fabric","1","50","0","23.0000","",""
DS-EMBS201313-FB,"Cayenne Jamawar Silk Fabric","1","50","0","26.0000","",""
DS-EMBS201314-FB,"Taj Mahal Silk Fabric","0","50","0","0.0000","",""
DS-EMBS201315-FB,"Mirror Pearl White Silk Fabric","0","50","0","0.0000","",""
DS-EMBS201316-FB,"Bellagio Silver Silk Fabric","0","50","0","0.0000","",""
DS-EMBS201317-FB,"Merlot Jamawar Silk Fabric","0","50","0","0.0000","",""
DS-EMBS201319-FB,"Trophy Bold Red Silk Fabric","0","0","0","0.0000","",""
DS-EMBS201319-FB45,"test","1","0","0","0.0000","",""
DS-EMBS20132-FB,"Trophy Sea Blue Thai Silk Fabric","0","50","0","0.0000","",""
DS-EMBS201320-FB,"Borrache Silk Fabric","2","0","0","0.0000","",""
DS-EMBS201321-FB,"Dahlia Silk Fabric","5","0","0","0.0000","",""
DS-EMBS201322-FB,"Olivia Silk Fabric","0","0","0","0.0000","",""
DS-EMBS201323-FB,"Rubia Silk Fabric","0","0","0","0.0000","",""
DS-EMBS201324-FB,"Sterling Silk Fabric","0","0","0","0.0000","",""
DS-EMBS201327-FB,"test","0","50","2","12.0000","",""
DS-EMBS20133-FB,"Cassandra Sage Green Thai Silk Fabric","0","0","0","0.0000","",""
DS-EMBS20134-FB,"Baldwin Merlot Silk Fabric","0","0","0","0.0000","",""
DS-EMBS20135-FB,"Indria Pearl White Silk Fabric","0","89","0","0.0000","",""
DS-EMBS20136-FB,"Istanbul Cayenne Silk Fabric","0","0","0","0.0000","",""
DS-EMBS20137-FB,"Chai Silver Thai Silk Fabric","0","0","0","0.0000","",""
DS-EMBS20138-FB,"Bombay Bold Red Silk Fabric","0","0","0","0.0000","",""
DS-MDSTK2-FB,"Woodbury Silk Taffeta Stripe Fabric","0","0","0","0.0000","",""
DS-MDSTK5-FB,"Preston Silk Taffeta Stripe Fabric","0","0","0","0.0000","",""
DS-MSTK1-FB,"Blue Water Silk Fabric","10","0","1","2.2200","",""
DS-MSTK4-FB,"Eureka Silk Stripe Fabric","0","0","0","0.0000","",""
DS-MSTK5-FB,"Providence Silk Taffeta Stripe Fabric","0","0","0","0.0000","",""
DS-PS001-FB,"Cambridge White Silk Stripe Fabric","0","0","0","0.0000","",""
DS-PS002-FB,"Cambridge Cream Silk Stripe Fabric","0","0","0","0.0000","",""
DS-PS003-FB,"Cambridge Grey Silk Stripe Fabric","0","0","0","0.0000","",""
DS-SDG6-FB,"Bengali Silk Stripe Fabric","0","0","0","0.0000","",""
DS-SLK02-FB,"Bristol Silk Stripe Fabric","0","0","0","0.0000","",""
DS-SLK136-FB,"Serendipity Silk Taffeta Stripe Fabric","0","0","0","0.0000","",""
DS-SLK196-FB,"Waterford Gold Silk Stripe Fabric","0","0","0","0.0000","",""
DS-SLK33-FB,"NEW: Sheffield Silk Plaid Fabric","0","0","0","0.0000","",""
DS-SLK50-FB,"Waterford Sienna Silk Stripe Fabric","0","0","0","0.0000","",""
DS-SLK83-FB,"Waterford Sand Silk Stripe Fabric","0","0","0","0.0000","",""
DS-SSL28-FB,"Toscano Silk Taffeta Stripe Fabric","0","0","0","0.0000","",""
DS-TF514-FB,"Bellevue Silk Taffeta Stripe Fabric","0","0","0","0.0000","",""
DS-TF708-FB,"Cyprus Silk Taffeta Stripe Fabric","0","0","0","0.0000","",""
DS-TF926-FB,"Tulare Silk Taffeta Stripe Fabric","0","0","0","0.0000","",""
DS-TF940-FB,"Belmont Silk Taffeta Stripe Fabric","0","0","0","0.0000","",""
DS-TF944-FB,"Pacific Heights Silk Stripe Fabric","0","0","0","0.0000","",""
DS-TF959-FB,"Hawthorne Silk Stripe Fabric","0","0","0","0.0000","",""
DS-TFSN25-FB,"Dallas Silk Taffeta Satin Stripe Fabric","0","0","0","0.0000","",""
DS-TFSN30-FB,"Beverly Hills Silk Taffeta Stripe Fabric","0","0","0","0.0000","",""
DS-TFSN33-FB,"Melrose Silk Taffeta Satin Stripe Fabric","0","0","0","0.0000","",""
DS-TLT17-FB,"Dynasty Silk Taffeta Plaid Fabric","0","0","0","0.0000","",""
DS-TS001-FB,"Brighton Grey Silk Stripe Fabric","0","0","0","0.0000","",""
DS-TS002-FB,"Brighton Blue Silk Stripe Fabric","0","0","0","0.0000","",""
EFSCH-20134A-FB,"Romanian Silver Embroidered Faux Silk Fabric","0","0","0","0.0000","",""
EFSCH-20134B--FB,"Romanian Iridescence Embroidered Faux Silk Fabric","0","50","0","0.0000","",""
EFSCH-20134C-FB,"Romanian Copper Embroidered Faux Silk Fabric","0","0","0","0.0000","",""
EFSCH-20134D1-FB,"Lyon Crème Embroidered Faux Silk Fabric","0","0","0","0.0000","",""
EFSCH-20134D2-FB,"Lyon Bronze Embroidered Faux Silk Fabric","0","0","0","0.0000","",""
EFSCH-20134E1-FB,"St. Tropez Stone Embroidered Faux Silk Fabric","0","0","0","0.0000","",""
EFSCH-20134E2-FB,"St. Tropez Gold Embroidered Faux Silk Fabric","0","0","0","0.0000","",""
EFSCH-20134F1-FB,"Greco Ivory Embroidered Faux Silk Fabric","0","0","0","0.0000","",""
EFSCH-20134G1-FB,"Chai Embroidered Faux Silk Fabric","0","0","0","0.0000","",""
EFSCH-20136A-FB,"Morracco Bronze Embroidered Faux Silk Fabric","0","0","0","0.0000","",""
EFSCH-20136B-FB,"Luxembourg Bronze Embroidered Faux Silk Fabric","0","0","0","0.0000","",""
EFSCH-AL450C1-FB,"Alexandria Gold Faux Taffeta Silk Fabric","0","0","0","0.0000","",""
EFSCH-AL450C2-FB,"Alexandria Off White Taffeta Faux Silk Fabric","0","0","0","0.0000","",""
EFSCH-AL450C3-FB,"Alexandria Platinum Embroidered Faux Silk Fabric","0","50","0","0.0000","",""
EFSCH-AL450C4-FB,"Alexandria Merlot Faux Taffeta Silk Fabric","0","0","0","0.0000","",""
EFSCH-PLK850C1-FB,"Zen Garden Black Embroidered Faux Silk Fabric","0","0","0","0.0000","",""
EFSCH-PLK850C2-FB,"Zen Garden Chocolate Embroidered Faux Silk Fabric","0","0","0","0.0000","",""
EFSCH-PLK850C3-FB,"Zen Garden Iridescence Embroidered Faux Silk Fabric","0","0","0","0.0000","",""
EFSCH-PLK850C4-FB,"Zen Garden Harvest Embroidered Faux Silk Fabric","0","0","0","0.0000","",""
EFSCH-PLK850C5-FB,"Zen Garden Tango Embroidered Faux Silk Fabric","0","0","0","0.0000","",""
JQCH-2012201-FB,"Magdelena Golden Faux Silk Jacquard Fabric","0","0","0","0.0000","",""
JQCH-20122010-FB,"Magdelena Champagne Faux Silk Jacquard Fabric","0","0","0","0.0000","",""
JQCH-2012204-FB,"Magdelena Gold & Blue Faux Silk Jacquard Fabric","0","0","0","0.0000","",""
JQCH-2012206-FB,"Magdelena Silver & Blue Faux Silk Jacquard Fabric","0","0","0","0.0000","",""
JQCH-201263-FB,"Astoria Gold & Bronze Faux Silk Jacquard Fabric","0","0","0","0.0000","",""
JQCH-201266-FB,"Astoria Taupe & Mushroom Faux Silk Jacquard Fabric","0","0","0","0.0000","",""
JQCH-201268-FB,"Astoria Red & Bronze Faux Silk Jacquard Fabric","0","0","0","0.0000","",""
JQCH-201301-FB,"Astoria Black & Pewter Faux Silk Jacquard Fabric","0","0","0","0.0000","",""
JQCH-201302-FB,"Magdelena Black & Cognac Faux Silk Jacquard Fabric","0","0","0","0.0000","",""
JQCH-HANB10-FB,"Bjork Creme Jacquard Fabric","0","0","0","0.0000","",""
JQCH-HANB11-FB,"Espen Citron Jacquard Fabric","0","0","0","0.0000","",""
JQCH-HANB12A-FB,"Davin Neutral Jacquard Fabric","0","0","0","0.0000","",""
JQCH-HANB12B-FB,"Davin Grey Jacquard Fabric","0","0","0","0.0000","",""
JQCH-HANB13A-FB,"Surrey SmokeJacquard Fabric","0","0","0","0.0000","",""
JQCH-HANB13A-FB,"Surrey SmokeJacquard Fabric","0","50","0","0.0000","",""
JQCH-HANB13B-FB,"Surrey Russet Jacquard Fabric","0","0","0","0.0000","",""
JQCH-HANB13C-FB,"Surrey Aqua Jacquard Fabric","0","50","0","0.0000","",""
JQCH-HANB13D-FB,"Surrey Ivory Jacquard Fabric","0","0","0","0.0000","",""
JQCH-HANB1A-FB,"Copenhagen Taupe Jacquard with Organza Overlay Fabric","0","0","0","0.0000","",""
JQCH-HANB1B-FB,"Copenhagen Natural Jacquard with Organza Overlay Fabric","0","0","0","0.0000","",""
JQCH-HANB2-FB,"Safi Silver Jacquard Fabric","0","0","0","0.0000","",""
JQCH-HANB3A-FB,"Elsa Beige Jacquard Fabric","0","0","0","0.0000","",""
JQCH-HANB3B-FB,"Elsa Rouge Jacquard Fabric","0","0","0","0.0000","",""
JQCH-HANB4-FB,"Xena Jacquard Fabric","0","0","0","0.0000","",""
JQCH-HANB5A-FB,"Borneo Violet Jacquard Fabric","0","0","0","0.0000","",""
JQCH-HANB5B-FB,"Borneo Blue Jacquard Fabric","0","0","0","0.0000","",""
JQCH-HANB5C-FB,"Borneo Rust Jacquard Fabric","0","0","0","0.0000","",""
JQCH-HANB6-FB,"Dahl Multi Jacquard Fabric","0","0","0","0.0000","",""
JQCH-HANB7-FB,"Zeus Stone Jacquard Fabric","0","0","0","0.0000","",""
JQCH-HANB8-FB,"Athena Stone Jacquard Fabric","0","0","0","0.0000","",""
JQCH-HANB9-FB,"Flanders Multi Jacquard Fabric","0","0","0","0.0000","",""
LN-5000-FB,"Ivoire French Linen Fabric","0","0","0","0.0000","",""
LN-5100-FB,"Hemp French Linen Fabric","0","0","0","0.0000","",""
LN-5175-FB,"Truffle Brown French Linen Fabric","0","0","0","0.0000","",""
LN-5176-FB,"Blanc White French Linen Fabric","0","0","0","0.0000","",""
LN-5177-FB,"Denim Blue French Linen Fabric","0","0","0","0.0000","",""
LN-5178-FB,"Tango Red French Linen Fabric","0","0","0","0.0000","",""
LN-5179-FB,"Carbon Grey French Linen Fabric","0","0","0","0.0000","",""
LN-5520-FB,"Grigio Grey French Linen Fabric","0","0","0","0.0000","",""
PDCH-HANB08-FB,"Marshland Yarn Dyed Faux Dupioni Silk Fabric","0","0","0","0.0000","",""
PDCH-HANB10-FB,"Salt and Pepper Yarn Dyed Faux Dupioni Silk Fabric","0","0","0","0.0000","",""
PDCH-HANB23-FB,"Poppy Fields Yarn Dyed Faux Dupioni Silk Fabric","0","0","0","0.0000","",""
PDCH-HANB35-FB,"Chartreuse Yarn Dyed Faux Dupioni Silk Fabric","0","0","0","0.0000","",""
PDCH-HANB44-FB,"Blood Orange Yarn Dyed Faux Dupioni Silk Fabric","0","0","0","0.0000","",""
PDCH-HANB46-FB,"Cherrywood Yarn Dyed Faux Dupioni Silk Fabric","0","0","0","0.0000","",""
PDCH-HANB52-FB,"Blue Agave Yarn Dyed Faux Dupioni Silk Fabric","0","0","0","0.0000","",""
PDCH-HANB56-FB,"Blue Nile Yarn Dyed Faux Dupioni Silk Fabric","0","0","0","0.0000","",""
PDCH-HANB57-FB,"Pacific Storm Yarn Dyed Faux Dupioni Silk Fabric","0","0","0","0.0000","",""
PDCH-HANB60-FB,"Sable Yarn Dyed Faux Dupioni Silk Fabric","0","50","0","0.0000","",""
PDCH-HANB80-FB,"Parchment Yarn Dyed Faux Dupioni Silk Fabric","0","0","0","0.0000","",""
PDCH-HANB81-FB,"Winter Ivory Yarn Dyed Faux Dupioni Silk Fabric","0","0","0","0.0000","",""
PDCH-HANB83-FB,"Fiji Yarn Dyed Faux Dupioni Silk Fabric","0","0","0","0.0000","",""
PDCH-HANB84-FB,"Thistle Yarn Dyed Faux Dupioni Silk Fabric","0","50","0","0.0000","",""
PDCH-HANB85-FB,"Empire Gold Yarn Dyed Faux Dupioni Silk Fabric","0","0","0","0.0000","",""
PDCH-KBS1-FB,"Ice Vintage Textured Faux Dupioni Silk Fabric","0","0","0","0.0000","",""
PDCH-KBS10-FB,"Sea Glass Vintage Textured Faux Dupioni Silk Fabric","0","50","0","0.0000","",""
PDCH-KBS11-FB,"Smokey Plum Vintage Textured Faux Dupioni Silk Fabric","0","50","0","0.0000","",""
PDCH-KBS12-FB,"Rose Blush Vintage Textured Faux Dupioni Silk Fabric","0","50","0","0.0000","",""
PDCH-KBS13-FB,"Spice Vintage Textured Faux Dupioni Silk Fabric","0","0","0","0.0000","",""
PDCH-KBS14-FB,"Peacock Vintage Textured Faux Dupioni Silk Fabric","0","0","0","0.0000","",""
PDCH-KBS15-FB,"Lunar Blue Vintage Textured Faux Dupioni Silk Fabric","0","0","0","0.0000","",""
PDCH-KBS16-FB,"Burnt Orange Vintage Textured Faux Dupioni Silk Fabric","0","0","0","0.0000","",""
PDCH-KBS17-FB,"Mulberry Vintage Textured Faux Dupioni Silk Fabric","0","0","0","0.0000","",""
PDCH-KBS18-FB,"Provencial Blue Vintage Textured Faux Dupioni Silk Fabric","0","0","0","0.0000","",""
PDCH-KBS2-FB,"Off White Textured Vintage Faux Dupioni Silk Fabric","0","0","0","0.0000","",""
PDCH-KBS3-FB,"Almond Vintage Textured Faux Dupioni Silk Fabric","0","0","0","0.0000","",""
PDCH-KBS4-FB,"Brut Vintage Textured Faux Dupioni Silk Fabric","0","50","0","0.0000","",""
PDCH-KBS5-FB,"Ruby Vintage Textured Faux Dupioni Silk Fabric","0","0","0","0.0000","",""
PDCH-KBS6-FB,"Coffee Bean Vintage Textured Faux Dupioni Silk Fabric","0","0","0","0.0000","",""
PDCH-KBS7-FB,"Storm Grey Textured Vintage Faux Dupioni Silk Fabric","0","0","0","0.0000","",""
PDCH-KBS8-FB,"Flax Gold Vintage Textured Faux Dupioni Silk Fabric","0","0","0","0.0000","",""
PDCH-KBS9-FB,"Silver Vintage Textured Faux Dupioni Silk Fabric","0","0","0","0.0000","",""
PRTW-D01-FB,"Ogee Black Printed Cotton Fabric","0","0","0","0.0000","",""
PRTW-D02-FB,"Mayan Teal Printed Cotton Fabric","0","0","0","0.0000","",""
PRTW-D04-FB,"Sahara Desert Printed Cotton Fabric","0","0","0","0.0000","",""
PRTW-D05-FB,"Allium Blue Gray Printed Cotton Fabric","0","0","0","0.0000","",""
PRTW-D06A-FB,"Nairobi Desert Printed Cotton Fabric","0","0","0","0.0000","",""
PRTW-D06B-FB,"Nairobi Denim Printed Cotton Fabric","0","0","0","0.0000","",""
PRTW-D09-FB,"Bali Red Printed Cotton Fabric","0","0","0","0.0000","",""
PRTW-D11-FB,"Isles Mustard Printed Cotton Fabric","0","0","0","0.0000","",""
PRTW-D12-FB,"Impressions Grey Printed Cotton Fabric","0","0","0","0.0000","",""
PRTW-D13-FB,"Jakarta Khaki Printed Cotton Fabric","0","0","0","0.0000","",""
PRTW-D15-FB,"Cabana Burgundy Printed Cotton Fabric","0","0","0","0.0000","",""
PRTW-D16-FB,"Cabana Navy Printed Cotton Fabric","0","0","0","0.0000","",""
PRTW-D17-FB,"Cabana Black Printed Cotton Fabric","2","2","0","2.0000","",""
PRTW-D20-FB,"Medina Printed Cotton Fabric","0","0","0","0.0000","",""
PRTW-D21-FB,"Palu Printed Cotton Fabric","0","0","0","0.0000","",""
PRTW-D22-FB,"Sorong Printed Cotton Fabric","0","0","0","0.0000","",""
PRTW-D23-FB,"Mecca Printed Cotton Fabric","0","0","0","0.0000","",""
PRTW-D24A-FB,"Ikat Blue Printed Cotton Fabric","0","0","0","0.0000","",""
PRTW-D24B-FB,"Ikat Black Printed Cotton Fabric","0","0","0","0.0000","",""
PRTW-D25-FB,"Honeycomb Printed Cotton Fabric","0","0","0","0.0000","",""
PRTW-D26-FB,"Deuville Printed Cotton Fabric","0","0","0","0.0000","",""
PRTW-D27-FB,"Panama Printed Cotton Fabric","0","0","0","0.0000","",""
PRTW-D28-FB,"Marabella Printed Cotton Fabric","0","0","0","0.0000","",""
PRTW-D29A-FB,"Tide Sands Printed Cotton Fabric","0","0","0","0.0000","",""
PRTW-D29B-FB,"Tide Pools Printed Cotton Fabric","0","0","0","0.0000","",""
PRTW-D30-FB,"Picante Stripes Printed Cotton Fabric","0","0","0","0.0000","",""
PRTW-D31-FB,"Cabana Spice Printed Cotton Fabric","0","0","0","0.0000","",""
PRTW-D32-FB,"Cabana Teal Printed Cotton Fabric","0","0","0","0.0000","",""
PRTW-D33-FB,"Cabana Yellow Printed Cotton Fabric","0","0","0","0.0000","",""
PTCH-JTSP001-FB,"Azul Faux Silk Taffeta Fabric","0","0","0","0.0000","",""
PTCH-JTSP003-FB,"Mediterranean Faux Solid Taffeta Fabric","0","0","0","0.0000","",""
PTCH-JTSP005-FB,"Graphite Faux Silk Taffeta Fabric","0","0","0","0.0000","",""
PTCH-JTSP100-FB,"Fern Faux Silk Taffeta Fabric","0","0","0","0.0000","",""
PTCH-JTSP102-FB,"Dahlia Faux Silk Taffeta Fabric","0","0","0","0.0000","",""
PTCH-JTSP104-FB," Rum Raisin Faux Silk Taffeta Fabric","0","0","0","0.0000","",""
PTCH-JTSP1066-FB,"Syrah Faux Silk Taffeta Fabric","0","0","0","0.0000","",""
PTCH-JTSP112-FB,"Platinum Faux Silk Taffeta Fabric","0","0","0","0.0000","",""
PTCH-JTSP120-FB,"Eggshell Faux Silk Taffeta Fabric","0","0","0","0.0000","",""
PTCH-JTSP130907-FB,"Antique Beige Faux Silk Taffeta Fabric","0","0","0","0.0000","",""
PTCH-JTSP190912-FB,"Java Faux Silk Taffeta Fabric","0","0","0","0.0000","",""
PTCH-JTSP194010-FB,"Navy Blue Faux Silk Taffeta Fabric","0","0","0","0.0000","",""
PTCH-JTSP202-FB,"Flamingo Pink  Faux Silk Taffeta Fabric","0","0","0","0.0000","",""
PTCH-JTSP203-FB,"Fuchsia Rose Faux Silk Taffeta Fabric","0","0","0","0.0000","",""
PTCH-JTSP204--FB,"Hollywood Red Faux Silk Taffeta Fabric","0","50","0","0.0000","",""
PTCH-JTSP205-FB,"Harvest Orange Faux Silk Taffeta Fabric","0","0","0","0.0000","",""
PTCH-JTSP206-FB,"Gold Nugget Faux Silk Taffeta Fabric","0","0","0","0.0000","",""
PTCH-JTSP207-FB,"Wisteria Blue Faux Silk Taffeta Fabric","0","0","0","0.0000","",""
PTCH-JTSP208-FB,"Emerald Green Faux Silk Taffeta Fabric","0","0","0","0.0000","",""
PTCH-JTSP209-FB,"Copper Brown Faux Silk Taffeta Fabric","0","0","0","0.0000","",""
PTCH-JTSP27-FB,"Mushroom Faux Silk Taffeta Fabric","0","0","0","0.0000","",""
PTCH-JTSP29-FB,"White Faux Silk Taffeta Fabric","0","0","0","0.0000","",""
PTCH-JTSP41-FB,"Jet Black Faux Silk Taffeta Fabric","0","0","0","0.0000","",""
PTCH-JTSP5-FB,"Robins Egg Faux Silk Taffeta Fabric","0","0","0","0.0000","",""
PTCH-JTSP54-FB,"Honey Faux Silk Taffeta Fabric","0","0","0","0.0000","",""
PTCH-JTSP87-FB,"Paprika Faux Silk Taffeta Fabric","0","0","0","0.0000","",""
PTSCH-11082-FB,"Verona Faux Silk Taffeta Stripe Fabric","0","0","0","0.0000","",""
PTSCH-11083-FB,"Regency Faux Silk Taffeta Stripe Fabric","0","0","0","0.0000","",""
PTSCH-11087-FB,"Catalina Faux Silk Taffeta Stripe Fabric","0","0","0","0.0000","",""
PTSCH-11089-FB,"Presidio Faux Silk Taffeta Stripe Fabric","0","0","0","0.0000","",""
PTSCH-11091-FB,"Annabelle Faux Silk Taffeta Stripe Fabric","0","0","0","0.0000","",""
PTSCH-11093-FB,"Crockett Faux Silk Taffeta Stripe Fabric","0","0","0","0.0000","",""
PTSCH-11095-FB,"Rialto Faux Silk Taffeta Stripe Fabric","0","0","0","0.0000","",""
PTSCH-11096-FB,"Hampton Faux Silk Taffeta Stripe Fabric","0","0","0","0.0000","",""
PTSCH-11098-FB,"Orinda Faux Silk Taffeta Stripe Fabric","0","0","0","0.0000","",""
PTSCH-11100-FB,"Millazo Faux Silk Taffeta Stripe Fabric","0","0","0","0.0000","",""
PTSCH-12012-FB,"Marin Faux Silk Taffeta Stripe Fabric","0","0","0","0.0000","",""
PTSCH-13400-FB," Park Ave Faux Silk Taffeta Stripe Fabric","0","0","0","0.0000","",""
PTSCH-13401-FB,"Roxbury Faux Silk Taffeta Stripe Fabric","0","0","0","0.0000","",""
PTSCH-13402-FB,"Orleans Faux Silk Taffeta Stripe Fabric","0","0","0","0.0000","",""
PTSCH-13403-FB," Bergamo Faux Silk Taffeta Stripe Fabric","0","0","0","0.0000","",""
PTSCH-13404-FB,"Bijoux Faux Silk Taffeta Stripe Fabric","0","0","0","0.0000","",""
PTSCH-32012-FB,"Sake Faux Silk Taffeta Stripe Fabric","0","0","0","0.0000","",""
PTSCH-42012-FB,"Burma Faux Silk Taffeta Stripe Fabric","0","0","0","0.0000","",""
PTSCH-52012-FB,"Mirage Faux Silk Taffeta Stripe Fabric","0","0","0","0.0000","",""
PTSCH-72012-FB,"Kaleidoscope Faux Silk Taffeta Stripe Fabric","0","0","0","0.0000","",""
PTSCH-SLK211-FB,"Manchester Faux Silk Taffeta Stripe Fabric","0","0","0","0.0000","",""
PTSCH-SLK218-FB,"Cappuccino Faux Silk Taffeta Stripe Fabric","0","0","0","0.0000","",""
SH-ORG12-FB,"Ivory Silk Organza Sheer Fabric","0","0","0","0.0000","",""
SH-ORG2-FB,"Cream Silk Organza Sheer Fabric","0","0","0","0.0000","",""
SH-ORG48-FB,"Grey Silk Organza Sheer Fabric","0","0","0","0.0000","",""
SHCH-VOL1-FB,"Solid White Double Wide Voile Poly Sheer Fabric","0","0","0","0.0000","",""
SHCH-VOL3-FB,"Solid Off White Double Wide Voile Poly Sheer Fabric","0","0","0","0.0000","",""
SS-SBN11-FB,"Brown Gold Thai Silk Fabric","20","0","1","3.2200","",""
SS-SBR13-FB,"Bold Red Thai Silk Fabric","45","0","1","4.2200","",""
SS-SCB01-FB,"Chocolate Brown Thai Silk Fabric","30","0","2","5.2200","",""
SS-SCY22-FB,"Cayenne Thai Silk Fabric","40","0","2","6.2200","",""
SS-SG05-FB,"Sage Green Thai Silk Fabric","50","0","2","3.3300","",""
SS-SG17-FB,"Silver Grey Thai Silk Fabric","60","0","2","6.6600","",""
SS-SGD21-FB,"Gold Dust Thai Silk Fabric","70","0","2","9.9900","",""
SS-SMB19-FB,"Midnight Black Thai Silk Fabric","80","0","2","1.4500","",""
SS-SMR04-FB,"Merlot Thai Silk Fabric","0","0","0","0.0000","",""
SS-SPW28-FB,"Pearl White Thai Silk Fabric","0","0","0","0.0000","",""
SS-SSB02-FB,"Sea Blue Thai Silk Fabric","0","0","0","0.0000","",""
SS-STG16-FB,"Taupe Gold Thai Silk Fabric","0","0","0","0.0000","",""
SSRW-LF935-FB,"Cancun Sand Raw Silk Fabric","0","0","0","0.0000","",""
SSRW-LF951-FB,"Sandalwood Raw Silk Fabric","0","0","0","0.0000","",""
SSRW-LF952-FB,"Coconut Raw Silk Fabric","0","0","0","0.0000","",""
SSRW-LF953-FB,"Terracotta Raw Silk Fabric","0","0","0","0.0000","",""
SSRW-LF954-FB,"Cabo Mist Raw Silk Fabric","0","0","0","0.0000","",""
SSRW-LF956-FB,"Spanish Moss Raw Silk Fabric","0","0","0","0.0000","",""
SSRW-LF959-FB,"Cozumel Blue Raw Silk Fabric","0","0","0","0.0000","",""
SSTF-1-FB,"White Satin Silk Taffeta Fabric","0","0","0","0.0000","",""
SSTF-2-FB,"Creme Parfait Silk Taffeta Fabric","0","0","0","0.0000","",""
SSTF-3-FB,"Dijon Gold Silk Taffeta Fabric","0","0","0","0.0000","",""
SSTF-4-FB,"Nickel Silk Taffeta Fabric","0","0","0","0.0000","",""
SSTF-5-FB,"Tahitian Teal Silk Taffeta Fabric","0","0","0","0.0000","",""
SSTF-6-FB,"Chambord Silk Taffeta Fabric","0","0","0","0.0000","",""
SSTF-7-FB,"Scarlet Silk Taffeta Fabric","0","0","0","0.0000","",""
SSTF-8-FB,"Cognac Silk Taffeta Fabric","0","0","0","0.0000","",""
testcode,"testingFB","0","0","0","0.0000","",""
VCCH-VET1201-FB,"British Tan Vintage Cotton Velvet Fabric","0","0","0","0.0000","",""
VCCH-VET12010-FB,"Ebony Black Vintage Cotton Velvet Fabric","0","0","0","0.0000","",""
VCCH-VET1202-FB,"Chinchilla Grey Vintage Cotton Velvet Fabric","0","0","0","0.0000","",""
VCCH-VET1203-FB,"Claret Red Vintage Cotton Velvet Fabric","0","0","0","0.0000","",""
VCCH-VET1204-FB,"Majestic Plum Vintage Cotton Velvet Fabric","0","0","0","0.0000","",""
VCCH-VET1205-FB,"Indigo Blue Vintage Cotton Velvet Fabric","0","0","0","0.0000","",""
VCCH-VET1206-FB,"Kona Brown Vintage Cotton Velvet Fabric","0","0","0","0.0000","",""
VCCH-VET1207-FB,"Old Gold Vintage Cotton Velvet Fabric","0","0","0","0.0000","",""
